### ISSUE TITLE
Periodic client hang on OpenWRT

### ISSUE THREAD

**Issue by j0hnnyr0ck37** [nextdns/nextdns#559]
**Context**
 - CLI Version: 1.35.0
 - Platform: OpenWrt 19.07.7, r11306-c4a6851c72, armv7l

Periodically, the nextdns process is hanging, and it is necessary to `kill -9` the process followed by `nextdns start` in order for it to work again

```
# nextdns config
report-client-info true
detect-captive-portals false
hardened-privacy false
use-hosts true
max-inflight-requests 256
log-queries false
cache-size 0
discovery-dns
bogus-priv true
timeout 5s
setup-router true
listen 127.0.0.1:5342
control /var/run/nextdns.sock
cache-max-age 0s
config XXXXXX
max-ttl 0s
auto-activate true
```

```
# nextdns trace
goroutine 99190 [running]:
main.run.func4(0x0, 0x0, 0x1ec6610, 0x5)
	github.com/nextdns/nextdns@/run.go:177 +0x4c
github.com/nextdns/nextdns/ctl.(*Server).handle(0x1419940, 0x46f718, 0x1476c38, 0x1ec6610, 0x5, 0x0, 0x0, 0x0)
	github.com/nextdns/nextdns@/ctl/server.go:125 +0x178
github.com/nextdns/nextdns/ctl.(*Server).handleEvents(0x1419940, 0x46f718, 0x1476c38)
	github.com/nextdns/nextdns@/ctl/server.go:114 +0x110
created by github.com/nextdns/nextdns/ctl.(*Server).run
	github.com/nextdns/nextdns@/ctl/server.go:85 +0x8c

goroutine 1 [chan receive, 1059 minutes]:
github.com/nextdns/nextdns/host/service.runService(0x3da9d3, 0x7, 0x46db38, 0x14ec200, 0x141a901, 0x140e7c0)
	github.com/nextdns/nextdns@/host/service/run_unix.go:22 +0x90
github.com/nextdns/nextdns/host/service.Run(0x3da9d3, 0x7, 0x46db38, 0x14ec200, 0x5, 0x1410408)
	github.com/nextdns/nextdns@/host/service/run.go:19 +0x98
main.run(0x1482018, 0x1, 0x1, 0x0, 0x0)
	github.com/nextdns/nextdns@/run.go:388 +0x96c
main.main()
	github.com/nextdns/nextdns@/main.go:72 +0x144

goroutine 19 [syscall, 1059 minutes]:
os/signal.signal_recv(0x46d3f0)
	runtime/sigqueue.go:147 +0x130
os/signal.loop()
	os/signal/signal_unix.go:23 +0x14
created by os/signal.init.0
	os/signal/signal_unix.go:29 +0x30

goroutine 56 [IO wait]:
internal/poll.runtime_pollWait(0xa6b4dca8, 0x72, 0x0)
	runtime/netpoll.go:184 +0x44
internal/poll.(*pollDesc).wait(0x14a4474, 0x72, 0x10000, 0x10000, 0x0)
	internal/poll/fd_poll_runtime.go:87 +0x30
internal/poll.(*pollDesc).waitRead(...)
	internal/poll/fd_poll_runtime.go:92
internal/poll.(*FD).ReadFrom(0x14a4460, 0x15b6000, 0x10000, 0x10000, 0x0, 0x0, 0x0, 0x0, 0x0)
	internal/poll/fd_unix.go:219 +0x164
net.(*netFD).readFrom(0x14a4460, 0x15b6000, 0x10000, 0x10000, 0x14a4460, 0x66314, 0x664b4, 0xd350d616, 0xc03c197c)
	net/fd_unix.go:208 +0x38
net.(*UDPConn).readFrom(0x1476b08, 0x15b6000, 0x10000, 0x10000, 0x0, 0x0, 0x0, 0xd350d616)
	net/udpsock_posix.go:47 +0x38
net.(*UDPConn).ReadFromUDP(0x1476b08, 0x15b6000, 0x10000, 0x10000, 0x39d2, 0x6d4f40, 0x0, 0x0)
	net/udpsock.go:109 +0x40
github.com/nextdns/nextdns/discovery.(*MDNS).read(0x145c090, 0x46e2d8, 0x14796e0, 0x1476b08)
	github.com/nextdns/nextdns@/discovery/mdns.go:179 +0xd8
created by github.com/nextdns/nextdns/discovery.(*MDNS).Start
	github.com/nextdns/nextdns@/discovery/mdns.go:68 +0x1dc

goroutine 55 [IO wait]:
internal/poll.runtime_pollWait(0xa6b4dd2c, 0x72, 0x0)
	runtime/netpoll.go:184 +0x44
internal/poll.(*pollDesc).wait(0x14a4424, 0x72, 0x10000, 0x10000, 0x0)
	internal/poll/fd_poll_runtime.go:87 +0x30
internal/poll.(*pollDesc).waitRead(...)
	internal/poll/fd_poll_runtime.go:92
internal/poll.(*FD).ReadFrom(0x14a4410, 0x15a6000, 0x10000, 0x10000, 0x0, 0x0, 0x0, 0x0, 0x0)
	internal/poll/fd_unix.go:219 +0x164
net.(*netFD).readFrom(0x14a4410, 0x15a6000, 0x10000, 0x10000, 0x14a4410, 0x66314, 0x664b4, 0xd34d7c7f, 0xc03c197c)
	net/fd_unix.go:208 +0x38
net.(*UDPConn).readFrom(0x1476af8, 0x15a6000, 0x10000, 0x10000, 0x0, 0x0, 0x0, 0xd34d7c7f)
	net/udpsock_posix.go:47 +0x38
net.(*UDPConn).ReadFromUDP(0x1476af8, 0x15a6000, 0x10000, 0x10000, 0x39d2, 0x6d4f40, 0x0, 0x0)
	net/udpsock.go:109 +0x40
github.com/nextdns/nextdns/discovery.(*MDNS).read(0x145c090, 0x46e2d8, 0x14796e0, 0x1476af8)
	github.com/nextdns/nextdns@/discovery/mdns.go:179 +0xd8
created by github.com/nextdns/nextdns/discovery.(*MDNS).Start
	github.com/nextdns/nextdns@/discovery/mdns.go:64 +0x2b4

goroutine 57 [IO wait]:
internal/poll.runtime_pollWait(0xa6b4dc24, 0x72, 0x0)
	runtime/netpoll.go:184 +0x44
internal/poll.(*pollDesc).wait(0x14a44c4, 0x72, 0x10000, 0x10000, 0x0)
	internal/poll/fd_poll_runtime.go:87 +0x30
internal/poll.(*pollDesc).waitRead(...)
	internal/poll/fd_poll_runtime.go:92
internal/poll.(*FD).ReadFrom(0x14a44b0, 0x15c6000, 0x10000, 0x10000, 0x0, 0x0, 0x0, 0x0, 0x0)
	internal/poll/fd_unix.go:219 +0x164
net.(*netFD).readFrom(0x14a44b0, 0x15c6000, 0x10000, 0x10000, 0x14a44b0, 0x66314, 0x664b4, 0xd34d26bb, 0xc03c197c)
	net/fd_unix.go:208 +0x38
net.(*UDPConn).readFrom(0x1476b10, 0x15c6000, 0x10000, 0x10000, 0x0, 0x0, 0x0, 0xd34d26bb)
	net/udpsock_posix.go:47 +0x38
net.(*UDPConn).ReadFromUDP(0x1476b10, 0x15c6000, 0x10000, 0x10000, 0x39d2, 0x6d4f40, 0x0, 0x0)
	net/udpsock.go:109 +0x40
github.com/nextdns/nextdns/discovery.(*MDNS).read(0x145c090, 0x46e2d8, 0x14796e0, 0x1476b10)
	github.com/nextdns/nextdns@/discovery/mdns.go:179 +0xd8
created by github.com/nextdns/nextdns/discovery.(*MDNS).Start
	github.com/nextdns/nextdns@/discovery/mdns.go:64 +0x2b4

goroutine 58 [IO wait]:
internal/poll.runtime_pollWait(0xa6b4dba0, 0x72, 0x0)
	runtime/netpoll.go:184 +0x44
internal/poll.(*pollDesc).wait(0x14a4514, 0x72, 0x10000, 0x10000, 0x0)
	internal/poll/fd_poll_runtime.go:87 +0x30
internal/poll.(*pollDesc).waitRead(...)
	internal/poll/fd_poll_runtime.go:92
internal/poll.(*FD).ReadFrom(0x14a4500, 0x15d6000, 0x10000, 0x10000, 0x0, 0x0, 0x0, 0x0, 0x0)
	internal/poll/fd_unix.go:219 +0x164
net.(*netFD).readFrom(0x14a4500, 0x15d6000, 0x10000, 0x10000, 0x14a4500, 0x66314, 0x664b4, 0xd350afe8, 0xc03c197c)
	net/fd_unix.go:208 +0x38
net.(*UDPConn).readFrom(0x1476b20, 0x15d6000, 0x10000, 0x10000, 0x0, 0x0, 0x0, 0xd350afe8)
	net/udpsock_posix.go:47 +0x38
net.(*UDPConn).ReadFromUDP(0x1476b20, 0x15d6000, 0x10000, 0x10000, 0x39d2, 0x6d4f40, 0x0, 0x0)
	net/udpsock.go:109 +0x40
github.com/nextdns/nextdns/discovery.(*MDNS).read(0x145c090, 0x46e2d8, 0x14796e0, 0x1476b20)
	github.com/nextdns/nextdns@/discovery/mdns.go:179 +0xd8
created by github.com/nextdns/nextdns/discovery.(*MDNS).Start
	github.com/nextdns/nextdns@/discovery/mdns.go:68 +0x1dc

goroutine 54 [IO wait]:
internal/poll.runtime_pollWait(0xa6b4ddb0, 0x72, 0x0)
	runtime/netpoll.go:184 +0x44
internal/poll.(*pollDesc).wait(0x14a43d4, 0x72, 0x10000, 0x10000, 0x0)
	internal/poll/fd_poll_runtime.go:87 +0x30
internal/poll.(*pollDesc).waitRead(...)
	internal/poll/fd_poll_runtime.go:92
internal/poll.(*FD).ReadFrom(0x14a43c0, 0x1596000, 0x10000, 0x10000, 0x0, 0x0, 0x0, 0x0, 0x0)
	internal/poll/fd_unix.go:219 +0x164
net.(*netFD).readFrom(0x14a43c0, 0x1596000, 0x10000, 0x10000, 0x14a43c0, 0x66314, 0x664b4, 0xd3508ed4, 0xc03c197c)
	net/fd_unix.go:208 +0x38
net.(*UDPConn).readFrom(0x1476af0, 0x1596000, 0x10000, 0x10000, 0x0, 0x0, 0x0, 0xd3508ed4)
	net/udpsock_posix.go:47 +0x38
net.(*UDPConn).ReadFromUDP(0x1476af0, 0x1596000, 0x10000, 0x10000, 0x39d2, 0x6d4f40, 0x0, 0x0)
	net/udpsock.go:109 +0x40
github.com/nextdns/nextdns/discovery.(*MDNS).read(0x145c090, 0x46e2d8, 0x14796e0, 0x1476af0)
	github.com/nextdns/nextdns@/discovery/mdns.go:179 +0xd8
created by github.com/nextdns/nextdns/discovery.(*MDNS).Start
	github.com/nextdns/nextdns@/discovery/mdns.go:68 +0x1dc

goroutine 53 [IO wait]:
internal/poll.runtime_pollWait(0xa6b4de34, 0x72, 0x0)
	runtime/netpoll.go:184 +0x44
internal/poll.(*pollDesc).wait(0x14a4384, 0x72, 0x10000, 0x10000, 0x0)
	internal/poll/fd_poll_runtime.go:87 +0x30
internal/poll.(*pollDesc).waitRead(...)
	internal/poll/fd_poll_runtime.go:92
internal/poll.(*FD).ReadFrom(0x14a4370, 0x1586000, 0x10000, 0x10000, 0x0, 0x0, 0x0, 0x0, 0x0)
	internal/poll/fd_unix.go:219 +0x164
net.(*netFD).readFrom(0x14a4370, 0x1586000, 0x10000, 0x10000, 0x14a4370, 0x66314, 0x664b4, 0xd34d4b21, 0xc03c197c)
	net/fd_unix.go:208 +0x38
net.(*UDPConn).readFrom(0x1476ae0, 0x1586000, 0x10000, 0x10000, 0x0, 0x0, 0x0, 0xd34d4b21)
	net/udpsock_posix.go:47 +0x38
net.(*UDPConn).ReadFromUDP(0x1476ae0, 0x1586000, 0x10000, 0x10000, 0x39d2, 0x6d4f40, 0x0, 0x0)
	net/udpsock.go:109 +0x40
github.com/nextdns/nextdns/discovery.(*MDNS).read(0x145c090, 0x46e2d8, 0x14796e0, 0x1476ae0)
	github.com/nextdns/nextdns@/discovery/mdns.go:179 +0xd8
created by github.com/nextdns/nextdns/discovery.(*MDNS).Start
	github.com/nextdns/nextdns@/discovery/mdns.go:64 +0x2b4

goroutine 52 [IO wait]:
internal/poll.runtime_pollWait(0xa6b4deb8, 0x72, 0x0)
	runtime/netpoll.go:184 +0x44
internal/poll.(*pollDesc).wait(0x14a4334, 0x72, 0x10000, 0x10000, 0x0)
	internal/poll/fd_poll_runtime.go:87 +0x30
internal/poll.(*pollDesc).waitRead(...)
	internal/poll/fd_poll_runtime.go:92
internal/poll.(*FD).ReadFrom(0x14a4320, 0x1576000, 0x10000, 0x10000, 0x0, 0x0, 0x0, 0x0, 0x0)
	internal/poll/fd_unix.go:219 +0x164
net.(*netFD).readFrom(0x14a4320, 0x1576000, 0x10000, 0x10000, 0x14a4320, 0x66314, 0x664b4, 0xd35002db, 0xc03c197c)
	net/fd_unix.go:208 +0x38
net.(*UDPConn).readFrom(0x1476ad8, 0x1576000, 0x10000, 0x10000, 0x0, 0x0, 0x0, 0xd35002db)
	net/udpsock_posix.go:47 +0x38
net.(*UDPConn).ReadFromUDP(0x1476ad8, 0x1576000, 0x10000, 0x10000, 0x39d2, 0x6d4f40, 0x0, 0x0)
	net/udpsock.go:109 +0x40
github.com/nextdns/nextdns/discovery.(*MDNS).read(0x145c090, 0x46e2d8, 0x14796e0, 0x1476ad8)
	github.com/nextdns/nextdns@/discovery/mdns.go:179 +0xd8
created by github.com/nextdns/nextdns/discovery.(*MDNS).Start
	github.com/nextdns/nextdns@/discovery/mdns.go:68 +0x1dc

goroutine 51 [IO wait]:
internal/poll.runtime_pollWait(0xa6b4dfc0, 0x72, 0x0)
	runtime/netpoll.go:184 +0x44
internal/poll.(*pollDesc).wait(0x14a42e4, 0x72, 0x10000, 0x10000, 0x0)
	internal/poll/fd_poll_runtime.go:87 +0x30
internal/poll.(*pollDesc).waitRead(...)
	internal/poll/fd_poll_runtime.go:92
internal/poll.(*FD).ReadFrom(0x14a42d0, 0x1566000, 0x10000, 0x10000, 0x0, 0x0, 0x0, 0x0, 0x0)
	internal/poll/fd_unix.go:219 +0x164
net.(*netFD).readFrom(0x14a42d0, 0x1566000, 0x10000, 0x10000, 0x14a42d0, 0x66314, 0x664b4, 0xd34d0166, 0xc03c197c)
	net/fd_unix.go:208 +0x38
net.(*UDPConn).readFrom(0x1476ac0, 0x1566000, 0x10000, 0x10000, 0x0, 0x0, 0x0, 0xd34d0166)
	net/udpsock_posix.go:47 +0x38
net.(*UDPConn).ReadFromUDP(0x1476ac0, 0x1566000, 0x10000, 0x10000, 0x39d2, 0x6d4f40, 0x0, 0x0)
	net/udpsock.go:109 +0x40
github.com/nextdns/nextdns/discovery.(*MDNS).read(0x145c090, 0x46e2d8, 0x14796e0, 0x1476ac0)
	github.com/nextdns/nextdns@/discovery/mdns.go:179 +0xd8
created by github.com/nextdns/nextdns/discovery.(*MDNS).Start
	github.com/nextdns/nextdns@/discovery/mdns.go:64 +0x2b4

goroutine 50 [IO wait, 624 minutes]:
internal/poll.runtime_pollWait(0xa6b4e044, 0x72, 0x0)
	runtime/netpoll.go:184 +0x44
internal/poll.(*pollDesc).wait(0x14a4294, 0x72, 0x0, 0x0, 0x3da898)
	internal/poll/fd_poll_runtime.go:87 +0x30
internal/poll.(*pollDesc).waitRead(...)
	internal/poll/fd_poll_runtime.go:92
internal/poll.(*FD).Accept(0x14a4280, 0x0, 0x0, 0x0, 0x0, 0x0, 0x0, 0x0)
	internal/poll/fd_unix.go:384 +0x1a8
net.(*netFD).accept(0x14a4280, 0x7e11d600, 0x3, 0x0)
	net/fd_unix.go:238 +0x20
net.(*TCPListener).accept(0x14824d0, 0x143bea4, 0x143bea8, 0x50)
	net/tcpsock_posix.go:139 +0x20
net.(*TCPListener).Accept(0x14824d0, 0x3f9af4, 0x14103c0, 0x1, 0x1)
	net/tcpsock.go:261 +0x3c
github.com/nextdns/nextdns/proxy.Proxy.serveTCP(0x14103c0, 0x1, 0x1, 0x46d2b8, 0x140e730, 0x46ad08, 0x14f40c0, 0x46d2b8, 0x140e780, 0x1, ...)
	github.com/nextdns/nextdns@/proxy/tcp.go:29 +0x40
github.com/nextdns/nextdns/proxy.Proxy.ListenAndServe.func2(0x14103c0, 0x1, 0x1, 0x46d2b8, 0x140e730, 0x46ad08, 0x14f40c0, 0x46d2b8, 0x140e780, 0x1, ...)
	github.com/nextdns/nextdns@/proxy/proxy.go:136 +0x248
created by github.com/nextdns/nextdns/proxy.Proxy.ListenAndServe
	github.com/nextdns/nextdns@/proxy/proxy.go:128 +0x5b4

goroutine 33 [IO wait, 624 minutes]:
internal/poll.runtime_pollWait(0xa6b4d804, 0x72, 0x20)
	runtime/netpoll.go:184 +0x44
internal/poll.(*pollDesc).wait(0x14a4744, 0x72, 0xff00, 0xffff, 0x1ebaaa0)
	internal/poll/fd_poll_runtime.go:87 +0x30
internal/poll.(*pollDesc).waitRead(...)
	internal/poll/fd_poll_runtime.go:92
internal/poll.(*FD).ReadMsg(0x14a4730, 0x1e88000, 0xffff, 0xffff, 0x1ebaaa0, 0x20, 0x20, 0x0, 0x0, 0x0, ...)
	internal/poll/fd_unix.go:243 +0x198
net.(*netFD).readMsg(0x14a4730, 0x1e88000, 0xffff, 0xffff, 0x1ebaaa0, 0x20, 0x20, 0x0, 0x0, 0x3204d4, ...)
	net/fd_unix.go:214 +0x50
net.(*UDPConn).readMsg(0x1476bb0, 0x1e88000, 0xffff, 0xffff, 0x1ebaaa0, 0x20, 0x20, 0xb6e7836c, 0x0, 0x10, ...)
	net/udpsock_posix.go:59 +0x50
net.(*UDPConn).ReadMsgUDP(0x1476bb0, 0x1e88000, 0xffff, 0xffff, 0x1ebaaa0, 0x20, 0x20, 0xf2194d73, 0x1, 0x32efb4, ...)
	net/udpsock.go:142 +0x58
github.com/nextdns/nextdns/proxy.readUDP(0x1476bb0, 0x1e88000, 0xffff, 0xffff, 0x1ec32c0, 0x14103c0, 0x1, 0x1, 0x46d2b8, 0x140e730, ...)
	github.com/nextdns/nextdns@/proxy/udp.go:141 +0x78
github.com/nextdns/nextdns/proxy.Proxy.serveUDP(0x14103c0, 0x1, 0x1, 0x46d2b8, 0x140e730, 0x46ad08, 0x14f40c0, 0x46d2b8, 0x140e780, 0x1, ...)
	github.com/nextdns/nextdns@/proxy/udp.go:63 +0x10c
github.com/nextdns/nextdns/proxy.Proxy.ListenAndServe.func1(0x14103c0, 0x1, 0x1, 0x46d2b8, 0x140e730, 0x46ad08, 0x14f40c0, 0x46d2b8, 0x140e780, 0x1, ...)
	github.com/nextdns/nextdns@/proxy/proxy.go:119 +0x248
created by github.com/nextdns/nextdns/proxy.Proxy.ListenAndServe
	github.com/nextdns/nextdns@/proxy/proxy.go:111 +0x54c

goroutine 30 [chan receive, 1059 minutes]:
github.com/nextdns/nextdns/proxy.Proxy.ListenAndServe(0x14103c0, 0x1, 0x1, 0x46d2b8, 0x140e730, 0x46ad08, 0x14f40c0, 0x46d2b8, 0x140e780, 0x1, ...)
	github.com/nextdns/nextdns@/proxy/proxy.go:146 +0x5f8
main.(*proxySvc).start.func1(0x14769b0, 0x14ec200, 0x14769a8, 0x1466100)
	github.com/nextdns/nextdns@/run.go:96 +0x184
created by main.(*proxySvc).start
	github.com/nextdns/nextdns@/run.go:88 +0x80

goroutine 48 [IO wait]:
internal/poll.runtime_pollWait(0xa6b4e0c8, 0x72, 0x0)
	runtime/netpoll.go:184 +0x44
internal/poll.(*pollDesc).wait(0x14f6064, 0x72, 0x0, 0x0, 0x3da898)
	internal/poll/fd_poll_runtime.go:87 +0x30
internal/poll.(*pollDesc).waitRead(...)
	internal/poll/fd_poll_runtime.go:92
internal/poll.(*FD).Accept(0x14f6050, 0x0, 0x0, 0x0, 0x0, 0x0, 0x0, 0x0)
	internal/poll/fd_unix.go:384 +0x1a8
net.(*netFD).accept(0x14f6050, 0x1476c38, 0x0, 0x48e94)
	net/fd_unix.go:238 +0x20
net.(*UnixListener).accept(0x140d120, 0x14e9fcc, 0x14e9fd0, 0xc)
	net/unixsock_posix.go:162 +0x20
net.(*UnixListener).Accept(0x140d120, 0x3f9a94, 0x1419940, 0x46f718, 0x1476c38)
	net/unixsock.go:260 +0x3c
github.com/nextdns/nextdns/ctl.(*Server).run(0x1419940, 0x46db78, 0x140d120)
	github.com/nextdns/nextdns@/ctl/server.go:80 +0x24
created by github.com/nextdns/nextdns/ctl.(*Server).Start
	github.com/nextdns/nextdns@/ctl/server.go:52 +0xa8

goroutine 59 [IO wait]:
internal/poll.runtime_pollWait(0xa6b4db1c, 0x72, 0x0)
	runtime/netpoll.go:184 +0x44
internal/poll.(*pollDesc).wait(0x14a4564, 0x72, 0x10000, 0x10000, 0x0)
	internal/poll/fd_poll_runtime.go:87 +0x30
internal/poll.(*pollDesc).waitRead(...)
	internal/poll/fd_poll_runtime.go:92
internal/poll.(*FD).ReadFrom(0x14a4550, 0x15e6000, 0x10000, 0x10000, 0x0, 0x0, 0x0, 0x0, 0x0)
	internal/poll/fd_unix.go:219 +0x164
net.(*netFD).readFrom(0x14a4550, 0x15e6000, 0x10000, 0x10000, 0x14a4550, 0x66314, 0x664b4, 0xd34da398, 0xc03c197c)
	net/fd_unix.go:208 +0x38
net.(*UDPConn).readFrom(0x1476b28, 0x15e6000, 0x10000, 0x10000, 0x0, 0x0, 0x0, 0xd34da398)
	net/udpsock_posix.go:47 +0x38
net.(*UDPConn).ReadFromUDP(0x1476b28, 0x15e6000, 0x10000, 0x10000, 0x39d2, 0x6d4f40, 0x0, 0x0)
	net/udpsock.go:109 +0x40
github.com/nextdns/nextdns/discovery.(*MDNS).read(0x145c090, 0x46e2d8, 0x14796e0, 0x1476b28)
	github.com/nextdns/nextdns@/discovery/mdns.go:179 +0xd8
created by github.com/nextdns/nextdns/discovery.(*MDNS).Start
	github.com/nextdns/nextdns@/discovery/mdns.go:64 +0x2b4

goroutine 60 [IO wait]:
internal/poll.runtime_pollWait(0xa6b4da98, 0x72, 0x0)
	runtime/netpoll.go:184 +0x44
internal/poll.(*pollDesc).wait(0x14a45b4, 0x72, 0x10000, 0x10000, 0x0)
	internal/poll/fd_poll_runtime.go:87 +0x30
internal/poll.(*pollDesc).waitRead(...)
	internal/poll/fd_poll_runtime.go:92
internal/poll.(*FD).ReadFrom(0x14a45a0, 0x15f6000, 0x10000, 0x10000, 0x0, 0x0, 0x0, 0x0, 0x0)
	internal/poll/fd_unix.go:219 +0x164
net.(*netFD).readFrom(0x14a45a0, 0x15f6000, 0x10000, 0x10000, 0x14a45a0, 0x66314, 0x664b4, 0xd350712c, 0xc03c197c)
	net/fd_unix.go:208 +0x38
net.(*UDPConn).readFrom(0x1476b38, 0x15f6000, 0x10000, 0x10000, 0x0, 0x0, 0x0, 0xd350712c)
	net/udpsock_posix.go:47 +0x38
net.(*UDPConn).ReadFromUDP(0x1476b38, 0x15f6000, 0x10000, 0x10000, 0x39d2, 0x6d4f40, 0x0, 0x0)
	net/udpsock.go:109 +0x40
github.com/nextdns/nextdns/discovery.(*MDNS).read(0x145c090, 0x46e2d8, 0x14796e0, 0x1476b38)
	github.com/nextdns/nextdns@/discovery/mdns.go:179 +0xd8
created by github.com/nextdns/nextdns/discovery.(*MDNS).Start
	github.com/nextdns/nextdns@/discovery/mdns.go:68 +0x1dc

goroutine 61 [IO wait]:
internal/poll.runtime_pollWait(0xa6b4da14, 0x72, 0x0)
	runtime/netpoll.go:184 +0x44
internal/poll.(*pollDesc).wait(0x14a4604, 0x72, 0x10000, 0x10000, 0x0)
	internal/poll/fd_poll_runtime.go:87 +0x30
internal/poll.(*pollDesc).waitRead(...)
	internal/poll/fd_poll_runtime.go:92
internal/poll.(*FD).ReadFrom(0x14a45f0, 0x1606000, 0x10000, 0x10000, 0x0, 0x0, 0x0, 0x0, 0x0)
	internal/poll/fd_unix.go:219 +0x164
net.(*netFD).readFrom(0x14a45f0, 0x1606000, 0x10000, 0x10000, 0x14a45f0, 0x66314, 0x664b4, 0xd34dca78, 0xc03c197c)
	net/fd_unix.go:208 +0x38
net.(*UDPConn).readFrom(0x1476b40, 0x1606000, 0x10000, 0x10000, 0x0, 0x0, 0x0, 0xd34dca78)
	net/udpsock_posix.go:47 +0x38
net.(*UDPConn).ReadFromUDP(0x1476b40, 0x1606000, 0x10000, 0x10000, 0x39d2, 0x6d4f40, 0x0, 0x0)
	net/udpsock.go:109 +0x40
github.com/nextdns/nextdns/discovery.(*MDNS).read(0x145c090, 0x46e2d8, 0x14796e0, 0x1476b40)
	github.com/nextdns/nextdns@/discovery/mdns.go:179 +0xd8
created by github.com/nextdns/nextdns/discovery.(*MDNS).Start
	github.com/nextdns/nextdns@/discovery/mdns.go:64 +0x2b4

goroutine 62 [IO wait]:
internal/poll.runtime_pollWait(0xa6b4d990, 0x72, 0x0)
	runtime/netpoll.go:184 +0x44
internal/poll.(*pollDesc).wait(0x14a4654, 0x72, 0x10000, 0x10000, 0x0)
	internal/poll/fd_poll_runtime.go:87 +0x30
internal/poll.(*pollDesc).waitRead(...)
	internal/poll/fd_poll_runtime.go:92
internal/poll.(*FD).ReadFrom(0x14a4640, 0x1616000, 0x10000, 0x10000, 0x0, 0x0, 0x0, 0x0, 0x0)
	internal/poll/fd_unix.go:219 +0x164
net.(*netFD).readFrom(0x14a4640, 0x1616000, 0x10000, 0x10000, 0x14a4640, 0x66314, 0x664b4, 0xd3502cd1, 0xc03c197c)
	net/fd_unix.go:208 +0x38
net.(*UDPConn).readFrom(0x1476b50, 0x1616000, 0x10000, 0x10000, 0x0, 0x0, 0x0, 0xd3502cd1)
	net/udpsock_posix.go:47 +0x38
net.(*UDPConn).ReadFromUDP(0x1476b50, 0x1616000, 0x10000, 0x10000, 0x39d2, 0x6d4f40, 0x0, 0x0)
	net/udpsock.go:109 +0x40
github.com/nextdns/nextdns/discovery.(*MDNS).read(0x145c090, 0x46e2d8, 0x14796e0, 0x1476b50)
	github.com/nextdns/nextdns@/discovery/mdns.go:179 +0xd8
created by github.com/nextdns/nextdns/discovery.(*MDNS).Start
	github.com/nextdns/nextdns@/discovery/mdns.go:68 +0x1dc

goroutine 63 [IO wait]:
internal/poll.runtime_pollWait(0xa6b4d90c, 0x72, 0x0)
	runtime/netpoll.go:184 +0x44
internal/poll.(*pollDesc).wait(0x14a46a4, 0x72, 0x10000, 0x10000, 0x0)
	internal/poll/fd_poll_runtime.go:87 +0x30
internal/poll.(*pollDesc).waitRead(...)
	internal/poll/fd_poll_runtime.go:92
internal/poll.(*FD).ReadFrom(0x14a4690, 0x1626000, 0x10000, 0x10000, 0x0, 0x0, 0x0, 0x0, 0x0)
	internal/poll/fd_unix.go:219 +0x164
net.(*netFD).readFrom(0x14a4690, 0x1626000, 0x10000, 0x10000, 0x14a4690, 0x66314, 0x664b4, 0xd34caa9a, 0xc03c197c)
	net/fd_unix.go:208 +0x38
net.(*UDPConn).readFrom(0x1476b58, 0x1626000, 0x10000, 0x10000, 0x0, 0x0, 0x0, 0xd34caa9a)
	net/udpsock_posix.go:47 +0x38
net.(*UDPConn).ReadFromUDP(0x1476b58, 0x1626000, 0x10000, 0x10000, 0x39d2, 0x6d4f40, 0x0, 0x0)
	net/udpsock.go:109 +0x40
github.com/nextdns/nextdns/discovery.(*MDNS).read(0x145c090, 0x46e2d8, 0x14796e0, 0x1476b58)
	github.com/nextdns/nextdns@/discovery/mdns.go:179 +0xd8
created by github.com/nextdns/nextdns/discovery.(*MDNS).Start
	github.com/nextdns/nextdns@/discovery/mdns.go:64 +0x2b4

goroutine 64 [IO wait]:
internal/poll.runtime_pollWait(0xa6b4d888, 0x72, 0x0)
	runtime/netpoll.go:184 +0x44
internal/poll.(*pollDesc).wait(0x14a46f4, 0x72, 0x10000, 0x10000, 0x0)
	internal/poll/fd_poll_runtime.go:87 +0x30
internal/poll.(*pollDesc).waitRead(...)
	internal/poll/fd_poll_runtime.go:92
internal/poll.(*FD).ReadFrom(0x14a46e0, 0x1636000, 0x10000, 0x10000, 0x0, 0x0, 0x0, 0x0, 0x0)
	internal/poll/fd_unix.go:219 +0x164
net.(*netFD).readFrom(0x14a46e0, 0x1636000, 0x10000, 0x10000, 0x14a46e0, 0x66314, 0x664b4, 0xd3504e10, 0xc03c197c)
	net/fd_unix.go:208 +0x38
net.(*UDPConn).readFrom(0x1476b68, 0x1636000, 0x10000, 0x10000, 0x0, 0x0, 0x0, 0xd3504e10)
	net/udpsock_posix.go:47 +0x38
net.(*UDPConn).ReadFromUDP(0x1476b68, 0x1636000, 0x10000, 0x10000, 0x39d2, 0x6d4f40, 0x0, 0x0)
	net/udpsock.go:109 +0x40
github.com/nextdns/nextdns/discovery.(*MDNS).read(0x145c090, 0x46e2d8, 0x14796e0, 0x1476b68)
	github.com/nextdns/nextdns@/discovery/mdns.go:179 +0xd8
created by github.com/nextdns/nextdns/discovery.(*MDNS).Start
	github.com/nextdns/nextdns@/discovery/mdns.go:68 +0x1dc

goroutine 65 [chan receive, 1059 minutes]:
github.com/nextdns/nextdns/discovery.(*MDNS).Start.func1(0x145c090, 0x1487980, 0xe, 0x10, 0x46e2d8, 0x14796e0)
	github.com/nextdns/nextdns@/discovery/mdns.go:98 +0x238
created by github.com/nextdns/nextdns/discovery.(*MDNS).Start
	github.com/nextdns/nextdns@/discovery/mdns.go:76 +0x18c
```

`nextdns log` is empty at the time of the hang

**Comment by vincentbernat** [comment]
The trace does not show anything blocked at a location that would explain why it is blocked. Did you run `nextdns trace` relatively close to a request? Next time it happens, could you try both TCP and UDP?

```
dig -p 5342 www.google.com @127.0.0.1 +notcp
dig -p 5342 www.google.com @127.0.0.1 +tcp
```

**Comment by j0hnnyr0ck37** [comment]
Those actually both work, it looks like it is `dnsmasq` which is not responding here. However, restarting `dnsmasq` does not clear the issue, I do have to restart `nextdns` in order for it to work again.

**Comment by vincentbernat** [comment]
In this case, maybe `tcpdump -pni lo port 5342` when this does not work would help to understand what's happening.

**Comment by j0hnnyr0ck37** [comment]
Issue recurred again today, tcpdump shows:

```
21:07:02.920975 IP 127.0.0.1.23440 > 127.0.0.1.5342: UDP, length 78
21:07:02.921080 IP 127.0.0.1.50896 > 127.0.0.1.5342: UDP, length 80
21:07:02.921220 IP 127.0.0.1.22334 > 127.0.0.1.5342: UDP, length 66
21:07:02.921269 IP 127.0.0.1.22334 > 127.0.0.1.5342: UDP, length 91
21:07:02.921361 IP 127.0.0.1.22334 > 127.0.0.1.5342: UDP, length 84
21:07:02.921404 IP 127.0.0.1.22334 > 127.0.0.1.5342: UDP, length 91
21:07:02.921488 IP 127.0.0.1.19543 > 127.0.0.1.5342: UDP, length 92
21:07:02.921530 IP 127.0.0.1.22334 > 127.0.0.1.5342: UDP, length 74
21:07:02.921625 IP 127.0.0.1.22334 > 127.0.0.1.5342: UDP, length 91
21:07:02.921808 IP 127.0.0.1.22334 > 127.0.0.1.5342: UDP, length 91
21:07:02.921900 IP 127.0.0.1.22334 > 127.0.0.1.5342: UDP, length 74
21:07:02.922293 IP 127.0.0.1.5342 > 127.0.0.1.22334: UDP, length 41
21:07:02.922434 IP 127.0.0.1.5342 > 127.0.0.1.22334: UDP, length 41
21:07:02.922894 IP 127.0.0.1.22334 > 127.0.0.1.5342: UDP, length 74
21:07:02.923045 IP 127.0.0.1.5342 > 127.0.0.1.22334: UDP, length 41
21:07:02.923237 IP 127.0.0.1.22334 > 127.0.0.1.5342: UDP, length 91
21:07:02.923392 IP 127.0.0.1.22334 > 127.0.0.1.5342: UDP, length 91
21:07:03.924760 IP 127.0.0.1.14078 > 127.0.0.1.5342: UDP, length 81
21:07:03.925129 IP 127.0.0.1.22334 > 127.0.0.1.5342: UDP, length 80
21:07:03.925295 IP 127.0.0.1.18642 > 127.0.0.1.5342: UDP, length 91
21:07:03.925486 IP 127.0.0.1.36518 > 127.0.0.1.5342: UDP, length 66
21:07:03.925711 IP 127.0.0.1.60488 > 127.0.0.1.5342: UDP, length 74
21:07:03.925833 IP 127.0.0.1.5342 > 127.0.0.1.60488: UDP, length 41
```

**Comment by vincentbernat** [comment]
It's a bit hard to draw a conclusion from here. It seems that NextDNS is answering a few requests but there are more requests coming in than answers coming out, but maybe you did stop tcpdump before the answers get a chance to come out. This is a lot of requests in the same second, if it continues for many seconds, maybe you hit some anti DoS system (unsure if there is one at this level).

I suppose you did strip the requests for privacy purpose (otherwise `-v` should display them). Do you think all the requests are legitimate? Or maybe there are only a few requests but they are repeated all over because NextDNS is slow to answer? Do you see answers for each request or is there some requests that never get an answer?

**Comment by j0hnnyr0ck37** [comment]
Happened again today, `nextdns log` indicated:
```
Fri Sep  3 21:36:07 2021 daemon.warn nextdns[24395]: Endpoint failed: https://dns.nextdns.io#191.96.51.196,2602:ff62:181:2d6::,45.76.16.236,2001:19f0:5c01:1ebc:5400:2ff:fece:28ed: roundtrip: context deadline exceeded
```

Running dig with `+tcp` eventually works, but times out with `+notcp`. 

Running `tcpdump -pnvi lo port 5342` around the tcp query results in 

```
21:40:10.451627 IP (tos 0x0, ttl 64, id 13069, offset 0, flags [DF], proto TCP (6), length 60)
    127.0.0.1.43929 > 127.0.0.1.5342: Flags [S], cksum 0xfe30 (incorrect -> 0x5507), seq 3702920948, win 43690, options [mss 65495,sackOK,TS val 133534737 ecr 0,nop,wscale 6], length 0
21:40:10.451664 IP (tos 0x0, ttl 64, id 0, offset 0, flags [DF], proto TCP (6), length 60)
    127.0.0.1.5342 > 127.0.0.1.43929: Flags [S.], cksum 0xfe30 (incorrect -> 0x21bd), seq 2464613451, ack 3702920949, win 43690, options [mss 65495,sackOK,TS val 133534737 ecr 133534737,nop,wscale 6], length 0
21:40:10.451694 IP (tos 0x0, ttl 64, id 13070, offset 0, flags [DF], proto TCP (6), length 52)
    127.0.0.1.43929 > 127.0.0.1.5342: Flags [.], cksum 0xfe28 (incorrect -> 0xf2ab), ack 1, win 683, options [nop,nop,TS val 133534737 ecr 133534737], length 0
21:40:10.452154 IP (tos 0x0, ttl 64, id 13071, offset 0, flags [DF], proto TCP (6), length 105)
    127.0.0.1.43929 > 127.0.0.1.5342: Flags [P.], cksum 0xfe5d (incorrect -> 0x4d1e), seq 1:54, ack 1, win 683, options [nop,nop,TS val 133534738 ecr 133534737], length 53
21:40:10.452181 IP (tos 0x0, ttl 64, id 63741, offset 0, flags [DF], proto TCP (6), length 52)
    127.0.0.1.5342 > 127.0.0.1.43929: Flags [.], cksum 0xfe28 (incorrect -> 0xf274), ack 54, win 683, options [nop,nop,TS val 133534738 ecr 133534738], length 0
21:40:10.633714 IP (tos 0x0, ttl 64, id 26278, offset 0, flags [DF], proto UDP (17), length 142)
    127.0.0.1.51710 > 127.0.0.1.5342: UDP, length 114
21:40:10.633818 IP (tos 0x0, ttl 64, id 26279, offset 0, flags [DF], proto UDP (17), length 100)
    127.0.0.1.29521 > 127.0.0.1.5342: UDP, length 72
```

I'll see if I can't get dnsmasq logging so I can get some visibility into that as well.

**Comment by vincentbernat** [comment]
When you run `dig`, is it on port 5432 or on port 53? If it is against port 5432, send again the result of `nextdns trace` when the client does not answer to UDP requests.

**Comment by smargh** [comment]
Try setting bogus-priv to false. This seems to have resolved it for me, but I don't know what the root cause is.

/etc/config/netxtns:
option bogus_priv '0'

**Comment by j0hnnyr0ck37** [comment]
I ended up installing rsyslog on the router to capture more info, but the issue has not occurred since. I'll close this issue for now and open a new one if the issue return.s
